<?xml version="1.0" encoding="UTF-8" standalone="no"?>
<process-definition-extension 
xmlns="urn:jfire.org:processdefinition-extension_1_0" 
xmlns:xsi="http://www.w3.org/2001/XMLSchema-instance"
xsi:schemaLocation="urn:jfire.org:processdefinition-extension_1_0 http://www.jfire.org/schema/processdefinition-extension_1_0.xsd"
name="dev.jfire.org:Invoice.Vendor">
	<start-state name="dev.jfire.org:created">
		<name language="de">erzeugt</name>
		<description language="de">erzeugt</description>
		<name language="en">created</name>
		<description language="en">created</description>
		<icon file="" />
		<transition name="abort">
			<name language="de">abbrechen</name>
			<description language="de">abbrechen</description>
			<name language="en">abort</name>
			<description language="en">abort</description>
			<icon file="" />
		</transition>
		<transition name="finalize">
			<name language="de">finalisieren</name>
			<description language="de">finalisieren</description>
			<name language="en">finalize</name>
			<description language="en">finalize</description>
			<icon file="" />
		</transition>
		<transition name="dev.jfire.org:bookImplicitely"
			userExecutable="false">
			<name language="de">buchen-implizit</name>
			<description language="de">buchen-implizit</description>
			<name language="en">bookImplicitely</name>
			<description language="en">bookImplicitely</description>
			<icon file="" />
		</transition>
	</start-state>
	<state name="dev.jfire.org:finalized">
		<name language="de">finalisiert</name>
		<description language="de">finalisiert</description>
		<name language="en">finalized</name>
		<description language="en">finalized</description>
		<icon file="" />
		<transition name="dev.jfire.org:book">
			<name language="de">buchen</name>
			<description language="de">buchen</description>
			<name language="en">book</name>
			<description language="en">book</description>
			<icon file="" />
		</transition>
	</state>
	<end-state name="dev.jfire.org:aborted">
		<name language="de">abgebrochen</name>
		<description language="de">abgebrochen</description>
		<name language="en">aborted</name>
		<description language="en">aborted</description>
		<icon file="" />
	</end-state>
	<state name="dev.jfire.org:doubtful">
		<name language="de">zweifelhaft</name>
		<description language="de">zweifelhaft</description>
		<name language="en">doubtful</name>
		<description language="en">doubtful</description>
		<icon file="" />
		<transition name="dev.jfire.org:pay">
			<name language="de">zahlen</name>
			<description language="de">zahlen</description>
			<name language="en">pay</name>
			<description language="en">pay</description>
			<icon file="" />
		</transition>
		<transition name="bookUnreceivable">
			<name language="de">buchen-unempfangbar</name>
			<description language="de">buchen-unempfangbar</description>
			<name language="en">bookUnreceivable</name>
			<description language="en">bookUnreceivable</description>
			<icon file="" />
		</transition>
		<transition name="trust">
			<name language="de">vertrauen</name>
			<description language="de">vertrauen</description>
			<name language="en">trust</name>
			<description language="en">trust</description>
			<icon file="" />
		</transition>
	</state>
	<end-state name="dev.jfire.org:uncollectable">
		<name language="de">nicht-beitreibbar</name>
		<description language="de">nicht-beitreibbar</description>
		<name language="en">uncollectable</name>
		<description language="en">uncollectable</description>
		<icon file="" />
	</end-state>
	<end-state name="dev.jfire.org:paid">
		<name language="de">bezahlt</name>
		<description language="de">bezahlt</description>
		<name language="en">paid</name>
		<description language="en">paid</description>
		<icon file="" />
	</end-state>
	<state name="dev.jfire.org:booked">
		<name language="de">gebucht</name>
		<description language="de">gebucht</description>
		<name language="en">booked</name>
		<description language="en">booked</description>
		<icon file="" />
		<transition name="dev.jfire.org:send">
			<name language="de">senden</name>
			<description language="de">senden</description>
			<name language="en">send</name>
			<description language="en">send</description>
			<icon file="" />
		</transition>
	</state>
	<node name="dev.jfire.org:bookedUnreceivable">
		<name language="de">gebucht-unempfangbar</name>
		<description language="de">gebucht-unempfangbar</description>
		<name language="en">bookedUnreceivable</name>
		<description language="en">bookedUnreceivable</description>
		<icon file="" />
		<transition name="endAsUncollectable">
			<name language="de">endet-als-nicht-beitreibbar</name>
			<description language="de">endet-als-nicht-beitreibbar</description>
			<name language="en">endAsUncollectable</name>
			<description language="en">endAsUncollectable</description>
			<icon file="" />
		</transition>
	</node>
	<state name="dev.jfire.org:sentReminder">
		<name language="de">Mahnung-gesendet</name>
		<description language="de">Mahnung-gesendet</description>
		<name language="en">sentReminder</name>
		<description language="en">sentReminder</description>
		<icon file="" />
		<transition name="sendPreCollectionLetter">
			<name language="de">letzte-Mahnung-senden</name>
			<description language="de">letzte-Mahnung-senden</description>
			<name language="en">sendPreCollectionLetter</name>
			<description language="en">sendPreCollectionLetter</description>
			<icon file="" />
		</transition>
		<transition name="dev.jfire.org:pay">
			<name language="de">zahlen</name>
			<description language="de">zahlen</description>
			<name language="en">pay</name>
			<description language="en">pay</description>
			<icon file="" />
		</transition>
		<transition name="doubt">
			<name language="de">anzweifeln</name>
			<description language="de">anzweifeln</description>
			<name language="en">doubt</name>
			<description language="en">doubt</description>
			<icon file="" />
		</transition>
	</state>
	<state name="dev.jfire.org:sentPreCollectionLetter">
		<name language="de">letzte-Mahnung-gesendet</name>
		<description language="de">letzte-Mahnung-gesendet</description>
		<name language="en">sentPreCollectionLetter</name>
		<description language="en">sentPreCollectionLetter</description>
		<icon file="" />
		<transition name="doubt">
			<name language="de">anzweifeln</name>
			<description language="de">anzweifeln</description>
			<name language="en">doubt</name>
			<description language="en">doubt</description>
			<icon file="" />
		</transition>
		<transition name="dev.jfire.org:pay">
			<name language="de">zahlen</name>
			<description language="de">zahlen</description>
			<name language="en">pay</name>
			<description language="en">pay</description>
			<icon file="" />
		</transition>
	</state>
	<node name="dev.jfire.org:bookedImplicitely">
		<name language="de">gebucht-implizit</name>
		<description language="de">gebucht-implizit</description>
		<name language="en">bookedImplicitely</name>
		<description language="en">bookedImplicitely</description>
		<icon file="" />
	</node>
</process-definition-extension>